id,without_stt_accuracy_score,without_stt_empty_score,without_stt_prosody_score,without_stt_toatal_score,with_stt_accuracy_score,with_stt_empty_score,with_stt_prosody_score,with_stt_toatal_score,transcribed
el412_7,94.11626350256002,95.24,87.44210526315791,92.26612292190596,94.52145969498912,95.24,87.79117647058823,92.51754538852579,"Magic is all around us. Hi everyone, I'm Stella, and today, I want to tell you about my most favorite thing ever. Magic. Magic is like a 슬퍼 코치 that makes you go well. It's like when you see a rabbit up here at the same air, or when call for ribbons fly around like they're dancing. You know what's the best part? Magic is all around us. It's in the stars that shine so bright at night? In the rainboards after the rain and the beagles of my friends when we play together magic, those are hearts with joy and happiness like a warm hug from a unicorn. And guess what? We can do magic too! With our imagination, we can become brave wiz and create our own magical adventures. We can ride on the back of flying dragons and explore enchanted castles. So, let's believe in magic all around us. Let's see the world with wonder and let our imagination soar high like a magical kite. Let's make magic every day by being kind and spreading love like a sprinkle of magic. Let's make this world a magical place for everyone. Thank you for listening to my speech. I hope it makes you feel the magic in your heart too."
el281_8,83.63705069440364,95.61,76.8,85.34901689813455,65.35237493987493,95.61,73.57083333333333,78.17773609106942,"Hello everyone, my name is 주스앨렐라, English name Bella. Today, I'm going to tell you about my favorite things. First, I love the piano the most, speak and play, the white is angry, it's so beautiful and it's fun to learn how to play. second, I have an 아이스크림, it's always white and yellow and very clean. I have a fun mountain, it's quite lonely and jumpy, it is great exciting. Next, I have a wonderful drawing that I made. I draw many pictures of people like my teacher and cat. My 엄마는 좋아해, because they are black and many colors. Last, I have an interesting English book. It's called a magic tree house. It's about a boy and his sister who go back in time. This book helps me to learn about history and English. I really want to show you about my favorite day, thank you for listening to my speech."
el655_8,86.89548303004187,81.89,83.55882352941177,84.1147688531512,77.0521576674836,81.89,83.625,80.85571922249453,"Good afternoon everyone, my name is Tomy. Today, I want to talk about someone who inspires me a lot, Elon Musk. Have you ever dreamt of living on another planet riding in a car that drives itself? Well, Elon Musk is making those dreams come true. Elon Musk was born in South Africa and from a young age, he showed a passion for technology. He even taught himself to cook when he was just 12 years old. One of his biggest achievements was with 테슬라, a company that made electric cars popular and helped to use pollution. 테슬라 also found new sales driving technology. In addition to 테슬라, Elon must also achieve great success with SpaceX, which made space travel cheaper by inventing the first three useable rockets. Thanks to spacex, humans might one day live on Mars. however, what truly stands out about Musk is its determination. It failed 10,000 times but never gave up. It showed its hard work and still believes, even the widest dreams can come true. Elon Musk inspired me to dream it, take rest and never give up. I hope we all find the courage to pursue our dreams. I make a difference in the world. Thank you."
el477_7,85.10175418583724,86.42,80.8235294117647,84.11509453253397,73.7916157916158,86.42,74.01153846153846,78.07438475105143,"My name is Jin. Today, I want to talk about my service for soccer. soccer is fun for playing with a round ball on a big field. Two teams try to score goals by kicking the ball into the other team's net. I love soccer because it's fun and exciting. I play soccer with my friends during recess. Playing soccer with my friend is always fun and we get to work together as a team. I love the 팀워 and 스트레러지 involved in the 게임. Playing soccer in my team has taught me how to go perfect and sport well. soccer is not just about winning, it's about having fun and working together. My favorite part of soccer is making a great pass or scoring a goal. Soccer is an exciting sport that keeps me moving and having fun. My favorite player is Nancy, and I want to be as good as him sometimes. I also enjoy watching soccer games on TV and cheering for my favorite team with my dad. soccer is a great way to make friends and enjoy the outdoors. And playing soccer has me staying strong and healthy. Thank you for listening."
el378_6,86.81740944240944,95.94,83.68333333333334,88.81358092524759,78.984375,95.94,72.95,82.62479166666667,"An exciting swimming pool experience with my dad. I went to the swimming pool with my dad. In the swimming pool, I thought the waves would make me go to the shore because they were so strong. I would the water slide too. When I looked the water slide, the water was cool. Playing in the water with my dad was such a precious time."
el491_9,86.60502860235003,90.05,78.63214285714285,85.09572381983095,66.13045634920634,90.05,80.48333333333333,78.88792989417989,"Everyone, today we're going to explore a cool country called Korea. The capital city of South Korea is Goseo. In Korea, people speak Korean and use an alphabet called 한글. Korea food is super tasty. One famous dish is 김치. It is spicy, spicy, and vegetable that Koreans eat a lot almost every day. Also, Korea has beautiful nature, including the mountains and pretty beaches. In Seoul, you can visit traditional old places like Gyeongbokgung. Koreans people are very friendly and love to share their culture. Speaking of culture, 태권도 is a martial art from Korea with amazing kick and 점프. Korea is a fantastic place with so many amazing things to eat and discover. I hope you get to visit Korea and get to know about it more and more. Thank you for listening. Bye."
el581_8,53.645,82.55,58.68,64.95833333333333,23.223045603487538,82.55,49.575,51.78268186782918,"Let me introduce one of the heros in Korean history. Jeneral, 이순신, 이순신 was a great jeneral who lived long and he's best to remember, always brave and smart. Strains heresies during the Japanese invasion of Korea during the invasion of Korea during the invasion of Korea during the invasion of Korea during the invasion of Korea during the invasion of Korea during the invasion of Korea during the invasion of Korea during the invasion of Korea during the invasion of Korea during the invasion of Korea during the invasion of Korea during the invasion of Korea A marted shadow that made them hard to sing. 제이네나 리술신 was not only a brave fight, but also a nice leader who cared deeply about his country and his country. So that's him, 내 방에서, even when things were tough because of who he is, and he is still 2년 방, as a 4살 hero인 꼬리야 today."
el618_8,89.62205888653257,86.33,82.96333333333334,86.3051307399553,94.34721280762734,86.33,87.38076923076923,89.35266067946553,"For the 스피킹 contest, I'm going to talk about legos which is my favorite toy. When I was 5 years old, I saw my dad browsing the 레고 sites on the computer and got interested in 레고 right away. When I turned into 6 years old, I got my first LUE 레고 which I played with my little sister. But after playing with it 10 times, I lost them which made me unhappy. When I became 7 years old, the 레고랜 커리어 레젯 first opened.Since I was very interested in 레고, I visited there right away. In 레고랜, there are movie theaters and places where we can make legos. since it was so much fun visiting there, I still love to visit 레고랜 to this day. The reason I love legos is because I can make every single 레고. And I see everything It literally means everything. Because I can make statue, house and even buildings. Even though, there are so hard times making legos since it needs patience and time. When I finish making legos, I feel a sense of accomplishment and feel proud of myself. I plan to keep playing with legos in the future. Thank you!"
el269_8,81.08167894832317,76.93,77.11315789473684,78.37494561435334,77.83113898788639,76.93,81.19117647058823,78.65077181949154,"Hello everyone! It's not for being sweet, it is made from 코코 Beans and loved by all ages. Guess what it is? It's a 초콜릿. When you enjoy a piece of 초콜릿, you're not just tasting something yummy. It's like giving your body super zero power. 초콜릿 has special stuff called 엔지 오시덴. That hope gives you strong and healthy. That's not all. 초콜릿 is painful too. It can actually help you sing faster and remember things better. So, if you're stuck in a chicken mask problem, a little bit of dark 초콜릿 might just help you figure it out. And here's something fun. When you think of fight, it's like a little party in your mouth. Chocolate has ingredients that make you feel happy. The tunnel is like a tiny happiness messenger that makes you feel calm and good, almost like getting a big help. The Dwarfs are like little superheroes that cheer you up and make you feel even better. So, go ahead, read some chocolate and remember you're having super power. Thanks for listening and have a sweet day."
el400_42,0.0,100.0,0.0,33.333333333333336,0.0,100.0,0.0,33.333333333333336,
el620_9,92.38886858349579,94.22,88.31666666666666,91.64184508338748,94.18619281045753,94.22,88.59615384615384,92.3341155522038,"Hello, my name is Rebecca. Today, I'll talk about the importance of reading. As I read a lot of books for a while, I could feel the various effects of reading. I'd like to share 3 main things among them. First, reading books can develop our linguistic skills. Just a year ago, I didn't enjoy reading. As I had difficulty in areas such as grammar and reading, I started to read books. And as a result, I was able to make up for what I lack and my writing ability improved. second, reading helps us to improve our concentration. paying attention to the story to follow along helps our brain stay focused for longer periods of time. The more we practice reading, the better we get at focusing on other things like schoolwork or even sports. Lastly, reading allows us to have better knowledge. When we read books in various field, we can discover new fact that we didn't learn at school. The more you read, the more knowledge you get. It makes it easier to have fun conversations with classmates. Reading is a good daily habit. Even a few pages of reading can help us focus better, learn more, and become smarter. Thank you!"
el172_8,78.97180466180467,93.54,81.37666666666667,84.62949044282378,57.63626371112784,93.54,72.725,74.63375457037594,"I had it and today I'm going to talk about my favorite subject in school. My favorite subject in school is P.E. A physical education. I love P.E. Because it is so much fun and exciting, I enjoy exercise and P.E. Class gives me the chance to do that. Why? Having a great time in P.E will play well. My different games like basketball, baseball and soccer. Me also, my running and jumping rough which are some of my favorite activities every day is different and that makes it exciting because you never know what we will do next, I always look I'm looking forward to it because it's a break from sitting in class and I get to move around and stay active. Also, my favorite teacher is very kind and caring. She always makes sure everyone is inclusive and having fun. We even get to learn New game?"
el654_8,84.37644316467846,81.53999999999999,81.91176470588236,82.60940262352028,83.03209427465895,81.53999999999999,80.60416666666666,81.72542031377519,"Hi everyone, Merry Christmas! Yes, I know it's not Christmas but really wish it was. My name is 수연 and I want to tell you about my favorite holiday Christmas. Many people like winter because you can ski, make snowman, and drink hot chocolate. But I like winter because that's when Christmas is at Christmas time. You can start decorating. My family decorates a tree every year. We even decorate our living room and our apartment door. Another big thing about Christmas is presents. Many of my friends say they don't believe in 산타 클라스, but I should do that. Last year, he gave me four dogs. So if you want presents, Don't forget to write a letter to Sandra. My favorite thing about Christmas is celebrating time with my family. Oh, for the thing people can do at Christmas, our team, we do together. We all really like celebrating the tree and eating yummy candy can together. How about you, what do you love about Christmas?"
el403_8,89.83091075591074,88.77,85.48636363636363,88.02909146409145,80.7796712943745,88.77,83.97222222222223,84.50729783886557,"Hello everyone, my name is Julie. Welcome to my house. I love this place more than anywhere in the world. Let me show you around and you will see my house is great. First, I have a bedroom. My 테디벨 is in the toy box. The 필요 is on the bed. It is soft and white. My books are on the book shops. The mini 소파 is behind the bed. My dog is in the closet. Next, we have a 서드룸. There is a big desk and I read books here. The comic books are behind the desk. Over there is my mom's bedroom. There is a 마사 chair in a room. There is a plan behind the curtains. I love the plan, because it makes our house beautiful and fresh. There is a bathroom across from the storage room and another small bathroom next to my mom's bedroom. There is a hurry between the storage room and the answers. I like my house a lot because it is very comfortable and nice. Thanks for listening."
el526_9,84.03766227644904,90.34,78.85624999999999,84.41130409214968,59.416666666666664,90.34,71.3,73.68555555555555,"Hello, my name is 다은, it is pleasure to meet you. Today, I want to introduce my favorite food which is 떡볶이. 떡볶이 is the food that I would love to eat. I will tell you how to make 떡볶이 today. Before you make, you need some ingredients such as red cake, fish cake and red pepper sauce. To make 떡볶이, you need to have a pot. Here are the steps you should follow first. Water in the pot and 보일. second, put red pepper sauce in the water and add some sugar and red pepper powder. When the water starts to 보일, you can add rice cake and fish cake. Lessonally, you can put some more eggs and onions to make it more delicious. If you don't like spicy food, you can put cheese on the top. So this is my special recipe to make 떡볶이. Isn't it easy? You should follow my recipe to make 떡볶이. Thank you for listening."
el690_7,85.07607824274491,93.88,83.05,87.33535941424832,86.26774376417234,93.88,81.75714285714287,87.30162887377173,"Hello everyone, my name is Harry. This month I'm going to talk about my favorite kinds of magic. My favorite magic is magic through the ring magic. That trip is there's a small hole in the ring and the second one is a nice blue magic. That trip is there's a small magnet there. The third magic is that dumb I sleep with a light. That truck has a small light inside the dump shape frame. Thank you for listening."
el141_8,73.19685143288083,68.45,57.599999999999994,66.41561714429362,25.925453886391388,68.45,55.7125,50.02931796213047,"Hello, my name is 눈경재, I'm nice out, have you ever 간 캠핑, I love 캠핑, I often go with my family, I'm going to talk about my 캠핑 trip, I don't own this summer, I'm with the 계산, with my mom, dad and baby brother on the same day. My dad grew up too. And? A present in the water? I'm just family on the two, but I'm okay with song, my mom, 축구 cake, of my baby brother, so I cook. A family rocket. Later on, or with I mean the title and swimming pool. I watched 유튜브 in the 캠핑장 and took a look at them."
el399_41,0.0,0.0,0.0,0.0,0.0,0.0,0.0,0.0,
el167_9,89.09011442036075,85.98,89.23157894736843,88.10056445590972,89.02834001224093,85.98,88.46578947368423,87.8247098286417,"Chase, who was Linkin's treasure secretary, said the wish never happened, but the poor are already experiencing how. Did you ever know how many people die because of starvation? I will tell you. Every 5 second, a child is dying due to hungry. Every day, 25,000 people, including more than 10,000 children, die from hungry and related causes. The first reason why many people are hungry is because of the price of bread increasing due to climate changes. Climate Changes are due to pollution. The second reason is that while we're concentrated in developed countries, people in pool countries are about to be exposed to hungry. What can you do to prevent starvation? Pollution should be stopped. The easy thing we can do is to eat everything without leaving any food behind. You should be thankful for the food you have right now. We should donate for undevelop countries such as Africa. One friendly letter to Africa will give them some water and bread. Don't just think, move into action. I'm trying my best to eat all of my food and I'm also giving donations every year. There are lots of things we can do. Let's try our best to stop starvation. Thank you for listening."
el185_9,91.58449874587686,88.48,86.46071428571429,88.84173767719705,91.96692821067822,88.48,89.39500000000001,89.94730940355942,"Hello, my name is Stanley. Today, I like to talk about the movie called inside out. The movie is about emotions. There were not many characters in inside out 1, but more characters appeared when inside out 2 was released. Next, I will tell you about my favorite character. Everyone loves Joy, but mine is different. My favorite character is angry. Because when Joy was angry and sad, he comforted Joy. Anger is not always angry, however, I hate anxiety because she almost broke the main character's brain. After watching the movie, I thought about my emotions too. The most emotion that I feel is anxiety, because when I meet a difficult question, I feel anxious, especially math. I can study math well when I get easy math questions. But when I get difficult math tests, I feel anxious and it gives me 스트레스 a lot and I hope I could study math with joy every day. I hope all of my emotions live heavily together with me."
el546_9,92.49196318671656,96.74,84.07272727272726,91.10156348648127,86.57539335664333,96.74,84.409375,89.24158945221444,"Hello, my name is 승진. This summer, I took her to the USA for the first time. First, I went to effort and I was very curious because there was so many people going to the USA. The flight to Chicago was hot because it took 14 hours. When I arrived in Chicago, I went to my grandmother's friend's house, I spent almost there. The next day was the best day. I got on the train and went to downtown Chicago. I bought many souvenils there, I was so impressed by all of the huge building, I ate hamburgers and tried some famous ice cream so I was for my favorite part of the whole trip was seeing downtown, it was so different from my home in polia. But I found a Korean 맛 there, I could buy Korean food that was surprising and helped me to feel less homesick. My first trip to the USA was wonderful experience and I was glad that the American children were kind to me. I hope I can go again soon, thank you for listening."
el115_9,77.16219336219338,14.599999999999994,68.27142857142857,53.34454064454064,58.61538461538461,14.599999999999994,59.6,44.27179487179487,"My name is 할인, my mom sadly lives in the USA, soon my family is going to visit them in LA. We are going to go to Disneyland too. I want an idea to look good here, because it's sad and scary. I want a version 7 years for my friend. We are going to stay at a 호텔 and meet my girlfriend. I want to try American hotdogs, they look delicious, I can't wait to go. We are going to have lots of fun."
el704_9,83.30666599973323,72.19,80.9857142857143,78.82746009514918,73.18785796105384,72.19,73.43333333333334,72.93706376479572,"Hello everyone, I'm 아인, I'm 10 years old. My favorite visit is Disneyland in LA. I want to tell you why I selected this place. First, it was my first 앞으로 travel with my family. The second? There is the wonderful white and food in Disneyland. The sad reason is that I got to buy a lot of character though for my best friend. The sad reason is that my favorite character, Mickey Mouse. I had fun and great memories. I will last forever from Disneyland. I would never forget. That is why Disneyland is my favorite place. When I remember that, I feel happy. Thank you for listening."
el723_6,75.56155689274202,79.31,75.12647058823529,76.66600916032577,79.70994766327583,79.31,78.2735294117647,79.09782569168017,"Hi, my name is Tina, and today I want to talk about my favorite popcorn. Many people love popcorn. Popcorn is great to eat at baseball games, movies, or just as a snack at home. But have you ever wondered why popcorn pops? Not a 콘텐트, I need to popcorn. Popcorn is made from a special variety of corn. Here how it works. When 팝콘이 져, the water inside the 건너 turns into steam. Steam is a kind of pocket. This steam needs more and more room, so it feels the fresher. The horses of the 팝콘 건너 keep the steam trap inside. When the pressure gets too high, the 건너 it flows and turns into lucky 팝콘. This happens so fast that it makes a 팝잉 sound. So next time you eat popcorn, remember how a tiny bit of water can turn into yummy food. That sounds delicious. Thanks for listening to my speech. Have a nice day."
el575_9,79.06235820824055,75.18,77.17666666666666,77.13967495830241,65.80057013273202,75.18,68.3875,69.78935671091068,"Hello, my name's Kevin, it is great to meet you. I have a great interest in soccer, I love playing soccer, and I also love watching soccer games. My favorite soccer team is Tochunam. From this beach, I want to tell you about my favorite team Tochunam. Tochunam is soccer team of England which was made in the 20th-century. It is now one of the best soccer team in the European League. Most famous players are Gary, Alex, Hector, and Colin's best player, Son Heung-rin. Son Heung-rin is the captain of Tochunam. Tochunam home stadium is called the sports stadium and the uniform is blue and white. Recently, Tochunam ran to 5th in Premier League. I love watching soccer games with my dad and on every weekend, I spend my time watching soccer with him. Your new league started last week. I hope Totum win the first place and hope 손흥민 get the MVP also the winning trophy this year. Let's go study! Thank you for listening."
el545_8,86.53392183975829,91.61,77.23333333333333,85.12575172436387,71.6004521004521,91.61,69.8,77.6701507001507,"Hello everyone, my name is 승희윤, I really like to exercise so I want to tell you about the sports activities that I like to do. First, I love to play dodgeball, I often play with my best friends, I am very good at dodgeball. Frand is even better so he usually win. Next, I enjoy riding my bicycle, I ride my bicycle every day, I mostly ride around my apartment with friends before I go to the bike paths next to 무십리버. Finally, my favorite sports is 배드민턴. My dream is to be a 배드민턴 player, I am lucky because there is a huge 배드민턴 샌들 and my 업무. About my building, I really like to go to the 배드민턴 course with my best friend while he might meet me in those. I always win at 배드민턴, it feels great to see myself get better and better after I practice. I like to exercise because it is good for my body, thank you for listening."
el661_8,86.10234697429267,86.63,79.82307692307693,84.1851412991232,88.84969576297821,86.63,83.54375,86.3411485876594,"Hello, my name is Lee Ha-rin. Today, I want to show how I felt like 깜양 after reading the book, The Cat Problem Solver. In the story, 깜양 is a clever cat who helps everyone in the village. After reading about his adventures, I wanted to be like him and make a difference. One day at school, my friend was very upset. Because she lost her favorite pencil. So I thought what 물감양 would look. Inspired 백감양, I started searching it everywhere. After looking around, I finally found the pencil hidden under some paper in the corner of the classroom. When I hand the pencil back to my friend, her big smile made me feel so happy. I learned that We can all be like 감양 by helping others and solving problems. No matter how small they are, thank you so much for listening."
el603_7,83.51677109440267,81.3,78.15526315789475,80.99067808409914,83.30282955606484,81.3,79.05,81.21760985202161,"Why I don't English? I love English. I know you don't say what, but I really do. This is Matt Nancy. I would like to talk about why I don't English. I think that English is fun. Some things have same names in both languages, such as a 택시, a 버스, or a 컴퓨터. My fish are always at apartment or microphone. The Korean language only to quite a few words and clue them apart and mic. It's fun to learn the four names. Also, English is very different from Korean. For example, the letter A has four different sounds. A has an apple, A has a lake. I live in America and often talk. It might be a little confusing, but I have no time for it. My goal in English is to talk to people really. until that day, I will keep learning English. Not only because I need to, but also because I want to. Thank you!"
