id,without_stt_accuracy_score,without_stt_empty_score,without_stt_prosody_score,without_stt_toatal_score,with_stt_accuracy_score,with_stt_empty_score,with_stt_prosody_score,with_stt_toatal_score,transcribed
el551_9,79.95919761890158,87.56,74.84062499999999,80.78660753963386,76.67133838383837,87.56,75.95833333333333,80.06322390572389,"Hello, my name is Sally and I am 10 years old. Today, I'm going to introduce a plant that I grow. The name of the plant I grow is called a fork. It's named fork because its shape remembers a fork. And its name fork is what I created for it. So the shape of the fork is very cute. The fork is a piece of 컨업 피팅 called 크리터포딥. I bought it from a plant store on Jan. 21, 2024. The fork needs to be watered once every 2 months, it requires a lot of 살았 and good air flow. The temperature should not 들어 without 지렁. In the fall, the plant shades its skin and during this time. It's important not to water it. When it says, the plant splits and tears apart. I will care my plant, fork really hard and make it really long. So far, this has been an introduction about my plant fork. Thank you for listening and goodbye."
el380_40,12.0,4.079999999999998,0.0,5.359999999999999,0.0,4.079999999999998,0.0,1.3599999999999994,안녕하세요 반갑습니다.
el152_9,90.40616257523803,98.57,84.30000000000001,91.092054191746,86.75810989616981,98.57,81.9,89.07603663205661,"Hi, my name is 은호, are you happy where you live, I am. Today I introduce the city where I live, 청주. 청주 is a beautiful town full of trees, flowers and plants and bugs on the biggest mountain 왕상. There are many convenient stores, movie theaters, nice nightlife. Nice neighbors, a river and great rules of all the places here. I like to go to the library more because it is quiet, I can focus on reading all the interesting books in the nice, quiet library. 청주 has lots of wonderful places to go. Cheongju's legacy is the 아이언 블랙볼 and the Jikji painting museum. Jikji is the oldest bookprint with moveable metal die in the world. How cool is that? Sandang Mountain for trees is also a beautiful place to go hiking and get an amazing view of the whole city from way up high. Cheongju is a great city to visit with your friends or family, so why don't you come here and take a look, I'm sure you will like what you see. Welcome to cheongju, thank you for listening."
el659_8,88.6371343229172,95.04,85.11875,89.59862810763907,66.78390920268988,95.04,78.75750000000001,80.1938030675633,"Hey, there are future leaders. Have you ever turned your ideas into something amazing? Maybe you thought about starting a fun 유튜브 채널 or even selling the best 초콜릿 and 향. Guess what? You can start right now. Today, I'm going to tell you how we, as kids, can turn our ideas into reality and become the next-generation of awesome entrepreneur. I read about a kid called Ryan Huey last year. When he was 3 years old, he discovered his love for recycling. On a trip to the recycling center with his dad, by age 7, he started his own company, Ryan's recycling, and Hanson's recycling over 1.6 million cans and bottles. Ryan also spoke at school and started a non-profit called products we are. He believes that would support kids coming a big difference by taking action. So what's helping us? We don't have to wait until we're older to start making a difference. We can start right now. whether it's a big idea or a small one, it stepens us closer to our dreams. Let's be brave, let's be creative, and let's become the kind of entrepreneur who shapes the future. Thank you!"
el580_9,87.04479797979799,81.6,83.3325,83.99243265993266,82.33134554300187,81.6,78.62,80.85044851433396,"Hey Ms. Juna, let me introduce the city today. There are many kinds of fish in the sea. There are about 20,000 kinds of fish in the sea. Also, if you look at the sea, there are many corals. instead of corals, they are why they are sleeping. Why is there also a 과리모? She is divided into different parts, and now I want to tell you about different types of sea. Of course, it's the deep sea. In the deep sea, there is a fish called angry fish. It is one of the most popular deep sea fish that everyone knows about. Normally, deep sea fish look scary and they are big. But in the tropical sea, most fish are small and they have cute appearances. Also, they have vivid colors. The most popular tropical fish is called guppy. They are very small and some people raise them at home. Also in the cold sea, tuna and bluefin live. Probably, we eat many fish from the cold sea. In addition, crazy-sensive, we live in the cold sea too. Isn't it very interesting to know about our sea. Our sea is a really amazing place."
el607_8,91.28051740646893,98.23,88.97058823529412,92.82703521392102,90.3143385450132,98.23,85.92,91.48811284833774,"Hello everyone, my name is James. Today, I want to talk about my favorite story and why I love reading. Stories stories are really fun and important for all of us. When we read stories, we can imagine new places and meet interesting characters. There are many types of stories. Some stories are funny, some are magical, and some teach us important lessons about life. My favorite story is called dogman. It is a comic book, which means it has lots of pictures and speech bubble. The story is about a half dog, half man, police officer who fights bad guys in one of the stories. The film B.D. the Cat escapes from J.O, but dogman is smart and catches him. The chief always says, good job dogman, because he is a hero, I really like the dogman, because he is both funny and brave. He always tries to do that, it's right, and he never gives up, even when things are hard. When I read about his adventures, it makes me want to be brave and kind too. I think reading stories helps us learn many things, they show us how to solve problems behind others and use our imagination. I hope you all read lots of fun stories too. Thank you for listening to my speech."
el265_7,91.81745243551966,94.93,85.46190476190475,90.73645239914147,89.76945145497778,94.93,87.75,90.81648381832593,"Hello everyone, I'm 소피아, I'm 8 years old. Today, I will tell you about all of the things that I like. I like to make cookies, I make delicious 초콜릿 쿠키, you should try them. Next, I like to play games. I always play 닌텐도 on the weekends with my sister. We play 닌텐도, sports and minecraft together. I like dogs, because they're so cute. I really want a pet dog, but my 마음 says I cannot yet, I really want a small white dog. I like to watch TV, my favorite show is Wee Bear Bear. It is so fun, I also listen to music when I have free time, I enjoy listening to all kinds of music. Of course, I love food. My favorite fruits are pizza and spaghetti. My dream is to be a cook. So I want to learn how to make pizza and spaghetti. I usually eat syrup for breakfast. It is easy to make. Most of all, I love my family. They are so nice and we do so much together. They help me with my homework every day and listen to me when I want to talk. Thank you for listening. Bye."
el572_9,79.41090969215969,66.3,76.78333333333333,74.16474767516435,69.09062040525022,66.3,75.3,70.23020680175007,"Hello everyone! Yes, how many books I read this year? More than 100 books when it's allowed and say, I will talk about why I love reading books. Reading a couple Boring, I need patience and concentration, but I'm sitting down. It is a long time to read a book, but I'm the least busy doing my homework and hanging out in France. Then, why do I like reading books? First, I came with a variety of different characters in the series. Reading helps me to understand my 수술하다 and improve my language ability. By reading books, I can improve 목욕 and center structure. 완전적이밀어, try to make short stories or even comic books are just fine. That's all I have to say. Thank you!"
el275_9,88.25008700449877,89.01,81.13823529411765,86.13277409953879,85.51388888888887,89.01,78.01666666666667,84.18018518518518,"Hello everyone, I am 손이야, I am 10 years old. Welcome to my bedroom. It is my favorite place, my bed is over here, it is pink and white. My grandma's bed is for me. When I was 6 years old, my bed is really cozy. There is my 테디벨 on the bed. Her name is Luna and she is very soft. My dog is next to my bed. It is pink and white, just like my bed. My desk is over there, I have many things on my desk, so it is messy sometimes. My book shelf is next to my desk. I have many books and I often read at my desk. I read many books. I really like books. My room has a big window so it is bright which makes me happy. I love my room. Thanks for listening."
el116_9,86.4040785000869,86.9,85.04285714285714,86.11564521431468,78.9397095959596,86.9,75.11666666666667,80.31879208754209,"Hello everyone, my name is Helen. I really like to watch Disney movies these days. I especially love Frozen and wish the new movie from Disney. I enjoy the music stories, creativity, imagination, storytelling, colors and everything. The music also captivates me. I used to go to an English academy, but I wasn't really interested in learning English there. While my friends like 케이팝, I prefer practicing Disneyland and sing along with the movie soundtracks. And this is how I started to enjoy learning English. Let me try acting Alison from Frozen. Oh, sorry. Oh, sorry. It's me, Anna, your sister. He didn't mean to make you freeze the summer, I'm sorry, it's all my fault. No, it had to be snow. She couldn't have the tropical magic that covered the furs and was in the warm fire. Yes, cold. How was it? Was it okay? I hope that someday I can sing a decent song track just like 언니 Jin from IW. Dreams are from small things, and I believe in mine. Thank you for listening to my little car."
el641_7,85.69017035595982,82.55,84.9,84.38005678531995,86.45555384158325,82.55,84.8111111111111,84.60555498423146,"Let me introduce my favorite animation named Pokemon. Pokemon is a super popular world loved by many people. It's about creatures called Pokemon that people can catch, train and metal. Pokemon are known for their different abilities like breeding, fire, or controlling water. The goal for a Pokemon trainer is to become the best by catching Pokemon, training them and battling others. The Pokemon world is colorful and full of adventures. Pokemon battles are exciting and teach players about strategies and team work. Pokemon encourages creativity, imagination and learning. It teaches about friendship, perseverance and working together. Overall, Pokemon is a fun and exciting world that continues to bring joy to fans everywhere."
el559_8,88.54706052461471,88.64,80.30000000000001,85.82902017487157,86.62611915886463,88.64,80.22857142857143,85.16489686247868,"My little jobs. Hello, my name is Olivia, I am 10 years old and I am in the 3rd grade. Today I am going to talk about my little jobs to begin with, I get up at 7 o'clock in the morning, then I make my bed because it is my job to keep my own room clean. I brush my hair and teeth before going to school. I always like to help my mom around the house so I set up the table for breakfast. Of course, I also help the dishes after we eat breakfast together. Then I pack my school bag by myself and go to school. After school I make sure to do all my homework for the day, I do my best to study well because I want to make my parents proud of me. I even read a lot of books. At home on my free time. Finally, after greeting my parents good night, I lay in my bed and go to sleep on my room. I am glad I can do all my little jobs."
el686_9,77.5523291925466,83.83,75.0375,78.80660973084886,76.13675607546575,83.83,76.75833333333333,78.90836313626636,"I love the electric Pokemon everyone loves, let me discuss about Pikachu, which is my favorite. Pikachu is one of the most famous Pokemon characters which brightens it up well and a lightening ball shape tail. Pikachu is an electric type Pokemon which means it can generalize and control electricity. It has big round cheeks that store electricity. Letting it use powerful moves like 던져 보트. Pikachu is special because of its friendly and lively personality. And it delivers and friendships adventure and fun, showing that even small creatures can have amazing abilities and make a big impact there. For I think Pikachu's strong and exciting character makes it a favorite character."
el553_7,73.72727272727272,57.43,72.35454545454544,67.83727272727272,61.11082848837209,57.43,65.175,61.238609496124035,"Hello, everyone! My name is Alessandra. I am 8. I go to Samseo Elementary school. Today, I will talk about 닌텐도. 닌텐도 is 게임 머신. It is small and light. I have red and blue Nintendo. I play fun games on Nintendo. I have 20 games. My favorite game is Midopia. Midopia is a 빠진 game. It is very fun and easy. I make me in the game. I am good at 원피스 게임. It is a Japanese game. It is a fighting game. I do it with friends. I want more in the 도집. I want 스프라톤 too. I will ask dad and mom. I love my 닌텐도. Thank you for listening. Bye."
el680_9,89.52791718085837,98.98,86.9346153846154,91.8141775218246,93.00913547237076,98.98,89.61500000000001,93.86804515745693,"Hello, my name is 김성준, a 3rd grade at Toa Elementary School. If you have emigrated or plan to go, why do you emigrate? I would like to talk about the main causes of immigration in the 5,000 years history of our country. Why man the Chinese refugees to go to the sea about 2400 years ago isn't early immigrant known in history books. Then, at the end of the Three Kingdom period, the refuges of Goryeo and Bejie collapsed by Sylla, migrated to China or Japan. during the Goryeo Dynasty, the kind of people who collapsed by Mongolia came to Goryeo. during the 임진 war from 1592 to 1598. Many skill parts of 조시안 were forced to move to Japan. And during the Japanese colonial period from 1910 to 1925, people moved to China or Russia to compete for independence. Today, Korean emigrate for various reasons, such as business, overseas employment, studying about marriage or self-satisfiction. according to the history, I think that most of immigration was for the comfortable and rich life. I hope that Korea will become a safe and rich country where people from all over the world want to visit or to live. Thank you for listening."
el454_9,84.90109268096884,88.05,80.1,84.35036422698961,83.75839325670152,88.05,78.19285714285715,83.33375013318623,"Hello, my name is Lily, I am 10 years old and I am in the third grade. Today, I am going to talk about my little 자세. To begin with, I get up at 7 o'clock in the morning, then I make my bed because it is my 저 to 기말을 늦게 해. Next, I brush my hair and teeth before going to school. I always like to have my 마을 around the house, so I sit at the table for breakfast. Of course, I also have to do the dishes after we eat breakfast together. Then I will get my school bag by myself and go to school. After school? I make sure to do all my homework for the day. I do my best to study well because I want to make my parents proud of me. I often read a lot of books at home on my free time. Finally, after telling my parents good night, I lie in my bed and go to sleep in my room. I am glad I can do all my 일 just by myself."
el729_9,89.74023173795901,96.38,89.3931818181818,91.8378045187136,94.39946402803545,96.38,91.0095238095238,93.92966261251975,"Hello everyone, I'm 김서현 and I'm a third grade student at 명원 elementary school. I want to talk about how we can live together on Earth and protect it. Do you know the magazine time? Every month they pick a new personality feature. however, in 1998 something special could. They didn't feature a person but picked Earth. People were concerned about what would happen if Earth got sick. It was a serious problem, because the main cause was due to humans. So, can we live with some biases with Earth? Yes. If we protect Earth, we can live together in harmony. We must start to protect Earth, because it's essential for our lives and future. Here are some simple ways we can protect our earth. First, the most important thing is recycling. You can do this by trashing correctly, like plastic bottles going into the recycling. I wish to invite you to recycle correctly too. second, blogging. This is where you pick up trash while jogging. Plogging helps you stay healthy by exercising, but you can clean up the earth at the same time. The best place would be the beach, as it's often polluted very easily. By doing these things, we can make the messes dry towards helping earth. Thank you for listening."
el490_8,88.90117679812374,98.27,80.41666666666667,89.1959478215968,85.47039565826331,98.27,81.71666666666667,88.48568744164334,"Hi everyone, today I want to tell you about my biggest dream, my dream job, my dream job is to be a model. I'm really excited to share why this is my dream and what it means to me, so let's get started. First, let me explain what model is. A model is someone who shows clothes and accessories to help designers to sell them. Motals often appear in magazines on long ways and in ads. It sounds like a fun job doesn't it? Not only that, my mom is a model so I want to be like her every time I see her also if I've always loved pretty things. When I was really little, I used to play, dress up, and make fashion shows with my friends. It was so much fun. As I grew up, I started to think, Hey, I want to do this for real. I am excited about the 졸업 ahead, the opportunity to learn and become an amazing model. Thank you for listening about my 졸업, I hope you enjoyed it."
el177_7,88.4248677248677,89.11,85.02333333333334,87.51940035273367,79.86013986013987,89.11,80.25,83.07337995337996,"Hi everyone, my name is 반준. Do you like to pick early insects? Most people don't, but I have insects. My dream is to become an insect science or an pharmacist when I grow up. I think insects are interesting because they are so many different kinds. I want to tell you about my favorite insect of praying mantis. The praying mantis looks scary. They have long thin bodies with sharp looking front legs that are a band. Like they are praying, mantis stand on their four high legs as they still hungry and wait for their prey. They like to eat pets like grasshop and ants. That's why I think farmers like to pray mantis too. The mantises' enemy are wasps. They fight them when they come close. So I hope you can see how some of these creepy, cloudy creatures are our friends. What is your favorite insect?"
el541_9,88.5745828634484,93.93,79.52857142857144,87.34438476400662,86.8756723074905,93.93,81.5090909090909,87.43825440552713,"Hello, my name is Ryan and I'm 10 years old. Among all my school subjects, I enjoy physical education the most because I find active exercise really fun. Today, I'd like to tell you about jump, jump and soccer, two of my favorite sports. But Jump rope is a simple activity which I can jump while turning a rope with my hands. I can do it anytime and anywhere. One of the best things about jump rope is that it helps me grow taller. I've been attending a 점프로프 아카데미 for the past year, and thanks to that, I won first place and improved my jump. Second, soccer is a sports which you score by getting the ball into the opponents' goal. To play well, you need good accuracy and speed recently. I play soccer with my friends, score a goal and we won the game. I felt really happy. Thank you for listening. Bye."
el383_40,0.0,78.95,0.0,26.316666666666666,2.0,78.95,18.9,33.28333333333333,"안녕하세요, contest assistant 4입니다."
el356_9,19.333333333333332,73.99,25.35333333333333,39.55888888888888,3.142857142857143,73.99,6.3,27.810952380952376,"알에 녹음하기 button을 누르고, 빗소리가 들리면 녹음을 시작하세요. 빗소리와 동시에 녹음을 시작하면 아픕는 녹음이 안 될 수 있습니다. 빗소리가 난 후 약 3층 후에 녹음을 시작하시기 바랍니다. 녹음을 마치셨으면 들어보기 button을 눌러서 정상적으로 녹음이 되었는지 확인하세요. 제 녹음에 필요하면 다시 녹음하기 button을 눌러서 제녹음하세요. 일곱삼일곱삼일곱삼일곱삼일곱삼일곱삼일곱삼일곱삼일곱삼일곱삼일곱삼일곱삼일곱삼일곱삼일곱삼일곱삼일곱삼일곱삼일곱삼일곱삼일곱삼일곱삼일곱삼일곱삼일곱삼일곱삼일곱삼일곱삼일곱삼일곱삼일곱삼일곱삼일곱삼일곱삼일곱삼일곱삼일곱삼일곱삼일곱삼일곱삼일곱삼일곱삼일곱삼일곱삼일곱� One, two, one, three."
el552_9,92.1987515408568,93.49,85.17894736842106,90.28923296975928,23.744311715331452,93.49,42.72,53.31810390511048,"Hello, ladies and gentlemen, my name is Jihun. Today, I will tell you about my family. First, the oldest person in my family is my grandma. My grandma is old but she looks very good for her age. My dad is my favorite person, because my dad is brave and kind. I also love my mom. My mom is a kind lady and she is very pretty. My oldest sister is 16 years old. She is scary and quiet, but she always tells me to go away. But I love my sister and I know that she is just growing up. Last, my younger brother is 8 years old. He is funny and cute, but he is so noisy. We do many fun things together as a family. We enjoy playing board games like 부루마블. It is exciting trying to win. We always eat dinner together too. We talk a lot about our days and share good memories. It feels so nice to spend time with each other. I love my family more than anything in the homework, thanks for listening."
el593_8,75.66736847201001,69.53,78.8,74.66578949067001,66.20333729451376,69.53,77.18333333333334,70.97222354261571,"Hello, everyone! What's up today? I'm sure to give you a unique peek into the future. I'm a little girl who traveled back from the future and I'm eager to show you all the incredible things I've seen. First off, you can travel to any place you want in a blink of an eye. You could have breakfast in Paris, lunch in New York. All about leaving your home. Imagine the fun of exploring new places every day without packing a single bag. Now, let's talk about a special potion that are providing one of the most amazing experience I have. Talking to animals. Yes, you heard me right? Thanks to this magical potion, I could communicate with my adorable puppy. Just imagine the joy of understanding your pet's thoughts and feelings. It's a heartwarming experience. Thank you all for join me on this journey to the wonders of tomorrow. I'm ready to be amazed, because the future is bright and full of all the possibilities."
el291_7,84.89402200796724,90.83,79.44117647058823,85.05506615951849,87.69694093565236,90.83,80.61333333333334,86.38009142299524,"Three wishes. If I can wish for any three things in the world, I will make these three wishes. First, I wish for everything I do will have a good result. The process of trying hard and doing my best is the most important, but if the result is also good, I will feel good, a good result will be confidence to take on other challenges. second, I wish everyone I know will be healthy. I think health is the most important thing in a life. When you are sick, your daily life becomes difficult. Being sick is sad. And if you are healthy, everything is fine. Stud, I wish the art will be clean. Poll is making our art very sick. Sometimes people make the art very dirty. We all need to help keep our art clean. We can help by picking up garbage when we see it. A good way to help the artist to recycle when we can recycle paper, plastic and glass, we can use some things many times before we throw them away. Our art is a beautiful place, we need to protect it."
el694_8,69.52702584452585,82.67,71.95333333333333,74.71678639261972,65.05738379267791,82.67,69.40555555555557,72.37764644941116,"Hello everyone, my name is 오롤라. Today, I want to tell you about two things I did during my summer vacation. First, I went to the 왈플, I went to the 왈플, with my family, Wendy was at the 왈플, we ate fresh fruits and went inside. I did some 스트레칭 before I went into the water and played with bugs. I had 아이스크림 and 핫도그스톤. It was really fun. Then I went to 광명 cave. The cave was very cold and dark. But it was very interesting because I saw many bats and fish, also I watched movies and took many pictures. There was also a video about 보켓너, but it was too scary for me. I almost ran away. I had fun during the summer vacation and I Already miss my summer. Thank you for listening to my story. Bye Bye."
el462_7,85.28595679012346,84.49,83.79166666666667,84.52254115226339,78.48864999758568,84.49,81.70769230769231,81.56211410175933,"Did you ever learn about the environment? I learned environment is science glad at my school. First of all, I'll show the definition to everyone about the environment. The environment means everything around it. All of our surroundings, including the air, soil, water, plants, and animals make up the environment. For today, I'll talk about water pollution. My name is Diana, and I'm the first student to 반신하면 at your school. There's so many reasons to have water pollution in our world today. I'll talk about two things. Natural causes and human causes of water pollution. Natural causes of water pollution can occur through like volcanoes, algae, animals, and stones and fruits. Especially during rainy season, water can spill over the river. And while that time, all the trash are mixing up together, and that cause water pollution. A lot of water pollutions come from humans too. Some of the companies have oil spills in the oceans and rivers. I think this is the biggest problem that cause water pollution. People must stop filling oil so we can keep the water clean. Thank you!"
